{
    "$schema": "http://json-schema.org/draft-04/schema#",
    "$id": "https://github.com/jetify-com/devbox",
    "title": "Devbox json definition",
    "description": "Defines fields and acceptable values of devbox.json and plugin descriptors. Both share one schema: a plugin descriptor is a devbox config that additionally requires name, version, and description fields, and may define create_files.",
    "type": "object",
    "properties": {
        "$schema": {
            "description": "The schema version of this config file.",
            "type": "string"
        },
        "name": {
            "description": "The name of the config. Required for plugin descriptors.",
            "type": "string"
        },
        "version": {
            "description": "The version of the plugin. Required for plugin descriptors.",
            "type": "string"
        },
        "description": {
            "description": "A description of the config. Required for plugin descriptors. This will automatically display when the user first installs the plugin, or runs `devbox info`.",
            "type": "string"
        },
        "devbox_version": {
            "description": "The devbox version (or semver constraint) this project requires, such as \"0.18.4\" or \"^0.18.0\". By default, running a different version prints a warning.",
            "oneOf": [
                {
                    "type": "string",
                    "description": "A devbox version or semver constraint. A mismatch prints a warning."
                },
                {
                    "type": "object",
                    "properties": {
                        "version": {
                            "type": "string",
                            "description": "A devbox version or semver constraint, such as \"0.18.4\" or \"^0.18.0\"."
                        },
                        "on_mismatch": {
                            "type": "string",
                            "description": "What to do when the running devbox version doesn't satisfy the constraint. \"warn\" prints a warning (default), \"error\" fails the command, and \"auto\" re-runs the command with the required version (requires an exact version).",
                            "enum": ["warn", "error", "auto"]
                        }
                    },
                    "required": ["version"],
                    "additionalProperties": false
                }
            ]
        },
        "packages": {
            "description": "Collection of packages to install",
            "oneOf": [
                {
                    "type": "array",
                    "items": {
                        "description": "Name and version of each package in name@version format.",
                        "type": "string"
                    }
                },
                {
                    "type": "object",
                    "description": "Name of each package in {\"name\": {\"version\": \"1.2.3\"}} format.",
                    "patternProperties": {
                        ".*": {
                            "oneOf": [
                                {
                                    "type": "object",
                                    "description": "Version number of the specified package in {\"version\": \"1.2.3\"} format.",
                                    "properties": {
                                        "version": {
                                            "type": "string",
                                            "description": "Version of the package"
                                        },
                                        "platforms": {
                                            "type": "array",
                                            "description": "Names of platforms to install the package on. This package will be skipped for any platforms not on this list",
                                            "items": {
                                                "enum": [
                                                    "i686-linux",
                                                    "aarch64-linux",
                                                    "aarch64-darwin",
                                                    "x86_64-darwin",
                                                    "x86_64-linux",
                                                    "armv7l-linux"
                                                ]
                                            }
                                        },
                                        "excluded_platforms": {
                                            "type": "array",
                                            "description": "Names of platforms to exclude the package on",
                                            "items": {
                                                "enum": [
                                                    "i686-linux",
                                                    "aarch64-linux",
                                                    "aarch64-darwin",
                                                    "x86_64-darwin",
                                                    "x86_64-linux",
                                                    "armv7l-linux"
                                                ]
                                            }
                                        },
                                        "glibc_patch": {
                                            "type": "boolean",
                                            "description": "Whether to patch glibc to the latest available version for this package"
                                        }
                                    }
                                },
                                {
                                    "type": "string",
                                    "description": "Version of the package to install."
                                }
                            ]
                        }
                    }
                }
            ]
        },
        "env": {
            "description": "List of additional environment variables to be set in the Devbox environment. Values containing $PATH or $PWD will be expanded. No other variable expansion or command substitution will occur. Environment variables in an included config are overridden by the including config.",
            "type": "object",
            "patternProperties": {
                ".*": {
                    "type": "string",
                    "description": "Value of the environment variable."
                }
            }
        },
        "create_files": {
            "type": "object",
            "description": "List of files to create in the user's project directory when the config is activated. The key points to the file path where the file will be created. The value points to the default file that should be copied to that location.",
            "patternProperties": {
                ".*": {
                    "type": "string",
                    "description": "Contents of the file."
                }
            }
        },
        "shell": {
            "description": "Definitions of scripts and actions to take when in devbox shell.",
            "type": "object",
            "properties": {
                "init_hook": {
                    "type": [
                        "array",
                        "string"
                    ],
                    "items": {
                        "description": "List of shell commands/scripts to run right after devbox shell starts.",
                        "type": "string"
                    }
                },
                "scripts": {
                    "description": "List of command/script definitions to run with `devbox run <script_name>`.",
                    "type": "object",
                    "patternProperties": {
                        ".*": {
                            "description": "Alias name for the script.",
                            "type": [
                                "array",
                                "string"
                            ],
                            "items": {
                                "type": "string",
                                "description": "The script's shell commands."
                            }
                        }
                    }
                }
            },
            "additionalProperties": false
        },
        "aliases": {
            "description": "Shell aliases set up when entering the devbox shell, after the init_hook runs. Works in bash, zsh, and fish.",
            "type": "object",
            "patternProperties": {
                ".*": {
                    "description": "The command the alias expands to.",
                    "type": "string"
                }
            }
        },
        "include": {
            "description": "List of additional configs to activate within your devbox shell: plugin descriptors, or other projects referenced by directory path or devbox.json path.",
            "type": "array",
            "items": {
                "description": "Name of the config to activate.",
                "type": "string"
            }
        },
        "env_from": {
            "type": "string"
        },
        "nixpkgs": {
            "type": "object",
            "properties": {
                "commit": {
                    "type": "string",
                    "description": "The commit hash of the nixpkgs repository to use"
                }
            }
        }
    },
    "additionalProperties": false
}
