{
  "packages": [
    "mariadb@latest"
  ],
  "shell": {
    "init_hook": [],
    "scripts": {
      "mysql": [
        "mysql --socket=$MYSQL_UNIX_PORT --user=root --password=''"
      ],
      "mariadb": [
        "mariadb --socket=$MYSQL_UNIX_PORT --user=root --password=''"
      ],
      "connect_db": [
        "mysql -u devbox_user -p -D devbox_lamp"
      ],
      "test_db_setup": [
        "mkdir -p /tmp/devbox/mariadb/run",
        "devbox services up -b",
        "sleep 5",
        "mysql -u root --password='' < setup_db.sql",
        "devbox services stop"
      ]
    }
  },
  "nixpkgs": {
    "commit": "f80ac848e3d6f0c12c52758c0f25c10c97ca3b62"
  },
  "env": {
   }
}
