{
  "name": "apache",
  "version": "0.0.4",
  "description": "If you with to edit the config file, please copy it out of the .devbox directory.",
  "env": {
    "HTTPD_DEVBOX_CONFIG_DIR": "{{ .DevboxProjectDir }}",
    "HTTPD_CONFDIR": "{{ .DevboxDir }}",
    "HTTPD_ERROR_LOG_FILE": "{{ .LogDir }}/error.log",
    "HTTPD_ACCESS_LOG_FILE": "{{ .LogDir }}/access.log",
    "HTTPD_PORT": "8080"
  },
  "create_files": {
    "{{ .DevboxDir }}/httpd.conf": "apache/httpd.conf",
    "{{ .DevboxDirRoot }}/web/index.html": "web/index.html",
    "{{ .Virtenv }}/process-compose.yaml": "apache/process-compose.yaml"
  }
}
